No.     Time           Source                Destination           Protocol Length Info
     66 20.261607      172.16.174.121        14.119.104.254        TCP      66     53344 → 80 [SYN] Seq=0 Win=64240 Len=0 MSS=1460 WS=256 SACK_PERM

Frame 66: 66 bytes on wire (528 bits), 66 bytes captured (528 bits) on interface \Device\NPF_{EE8E3F8B-5495-46B4-9F95-E9AF344B12E7}, id 0
Ethernet II, Src: IntelCor_99:34:96 (c4:d0:e3:99:34:96), Dst: WiWide_00:00:01 (00:1f:7a:00:00:01)
Internet Protocol Version 4, Src: 172.16.174.121, Dst: 14.119.104.254
Transmission Control Protocol, Src Port: 53344, Dst Port: 80, Seq: 0, Len: 0

No.     Time           Source                Destination           Protocol Length Info
     68 20.270376      14.119.104.254        172.16.174.121        TCP      66     80 → 53344 [SYN, ACK] Seq=0 Ack=1 Win=8192 Len=0 MSS=1300 WS=32 SACK_PERM

Frame 68: 66 bytes on wire (528 bits), 66 bytes captured (528 bits) on interface \Device\NPF_{EE8E3F8B-5495-46B4-9F95-E9AF344B12E7}, id 0
Ethernet II, Src: WiWide_00:00:01 (00:1f:7a:00:00:01), Dst: IntelCor_99:34:96 (c4:d0:e3:99:34:96)
Internet Protocol Version 4, Src: 14.119.104.254, Dst: 172.16.174.121
Transmission Control Protocol, Src Port: 80, Dst Port: 53344, Seq: 0, Ack: 1, Len: 0

No.     Time           Source                Destination           Protocol Length Info
     69 20.270435      172.16.174.121        14.119.104.254        TCP      54     53344 → 80 [ACK] Seq=1 Ack=1 Win=131072 Len=0

Frame 69: 54 bytes on wire (432 bits), 54 bytes captured (432 bits) on interface \Device\NPF_{EE8E3F8B-5495-46B4-9F95-E9AF344B12E7}, id 0
Ethernet II, Src: IntelCor_99:34:96 (c4:d0:e3:99:34:96), Dst: WiWide_00:00:01 (00:1f:7a:00:00:01)
Internet Protocol Version 4, Src: 172.16.174.121, Dst: 14.119.104.254
Transmission Control Protocol, Src Port: 53344, Dst Port: 80, Seq: 1, Ack: 1, Len: 0

No.     Time           Source                Destination           Protocol Length Info
     70 20.270635      172.16.174.121        14.119.104.254        HTTP     157    GET / HTTP/1.1 

Frame 70: 157 bytes on wire (1256 bits), 157 bytes captured (1256 bits) on interface \Device\NPF_{EE8E3F8B-5495-46B4-9F95-E9AF344B12E7}, id 0
Ethernet II, Src: IntelCor_99:34:96 (c4:d0:e3:99:34:96), Dst: WiWide_00:00:01 (00:1f:7a:00:00:01)
Internet Protocol Version 4, Src: 172.16.174.121, Dst: 14.119.104.254
Transmission Control Protocol, Src Port: 53344, Dst Port: 80, Seq: 1, Ack: 1, Len: 103
Hypertext Transfer Protocol

No.     Time           Source                Destination           Protocol Length Info
     71 20.280016      14.119.104.254        172.16.174.121        TCP      60     80 → 53344 [ACK] Seq=1 Ack=104 Win=29056 Len=0

Frame 71: 60 bytes on wire (480 bits), 60 bytes captured (480 bits) on interface \Device\NPF_{EE8E3F8B-5495-46B4-9F95-E9AF344B12E7}, id 0
Ethernet II, Src: WiWide_00:00:01 (00:1f:7a:00:00:01), Dst: IntelCor_99:34:96 (c4:d0:e3:99:34:96)
Internet Protocol Version 4, Src: 14.119.104.254, Dst: 172.16.174.121
Transmission Control Protocol, Src Port: 80, Dst Port: 53344, Seq: 1, Ack: 104, Len: 0

No.     Time           Source                Destination           Protocol Length Info
     73 20.295093      14.119.104.254        172.16.174.121        TCP      1334   80 → 53344 [ACK] Seq=1 Ack=104 Win=29056 Len=1280 [TCP segment of a reassembled PDU]

Frame 73: 1334 bytes on wire (10672 bits), 1334 bytes captured (10672 bits) on interface \Device\NPF_{EE8E3F8B-5495-46B4-9F95-E9AF344B12E7}, id 0
Ethernet II, Src: WiWide_00:00:01 (00:1f:7a:00:00:01), Dst: IntelCor_99:34:96 (c4:d0:e3:99:34:96)
Internet Protocol Version 4, Src: 14.119.104.254, Dst: 172.16.174.121
Transmission Control Protocol, Src Port: 80, Dst Port: 53344, Seq: 1, Ack: 104, Len: 1280

No.     Time           Source                Destination           Protocol Length Info
     74 20.295093      14.119.104.254        172.16.174.121        TCP      1334   80 → 53344 [ACK] Seq=1281 Ack=104 Win=29056 Len=1280 [TCP segment of a reassembled PDU]

Frame 74: 1334 bytes on wire (10672 bits), 1334 bytes captured (10672 bits) on interface \Device\NPF_{EE8E3F8B-5495-46B4-9F95-E9AF344B12E7}, id 0
Ethernet II, Src: WiWide_00:00:01 (00:1f:7a:00:00:01), Dst: IntelCor_99:34:96 (c4:d0:e3:99:34:96)
Internet Protocol Version 4, Src: 14.119.104.254, Dst: 172.16.174.121
Transmission Control Protocol, Src Port: 80, Dst Port: 53344, Seq: 1281, Ack: 104, Len: 1280

No.     Time           Source                Destination           Protocol Length Info
     75 20.295093      14.119.104.254        172.16.174.121        TCP      1334   80 → 53344 [ACK] Seq=2561 Ack=104 Win=29056 Len=1280 [TCP segment of a reassembled PDU]

Frame 75: 1334 bytes on wire (10672 bits), 1334 bytes captured (10672 bits) on interface \Device\NPF_{EE8E3F8B-5495-46B4-9F95-E9AF344B12E7}, id 0
Ethernet II, Src: WiWide_00:00:01 (00:1f:7a:00:00:01), Dst: IntelCor_99:34:96 (c4:d0:e3:99:34:96)
Internet Protocol Version 4, Src: 14.119.104.254, Dst: 172.16.174.121
Transmission Control Protocol, Src Port: 80, Dst Port: 53344, Seq: 2561, Ack: 104, Len: 1280

No.     Time           Source                Destination           Protocol Length Info
     76 20.295093      14.119.104.254        172.16.174.121        TCP      310    80 → 53344 [PSH, ACK] Seq=3841 Ack=104 Win=29056 Len=256 [TCP segment of a reassembled PDU]

Frame 76: 310 bytes on wire (2480 bits), 310 bytes captured (2480 bits) on interface \Device\NPF_{EE8E3F8B-5495-46B4-9F95-E9AF344B12E7}, id 0
Ethernet II, Src: WiWide_00:00:01 (00:1f:7a:00:00:01), Dst: IntelCor_99:34:96 (c4:d0:e3:99:34:96)
Internet Protocol Version 4, Src: 14.119.104.254, Dst: 172.16.174.121
Transmission Control Protocol, Src Port: 80, Dst Port: 53344, Seq: 3841, Ack: 104, Len: 256

No.     Time           Source                Destination           Protocol Length Info
     77 20.295093      14.119.104.254        172.16.174.121        TCP      1334   80 → 53344 [ACK] Seq=4097 Ack=104 Win=29056 Len=1280 [TCP segment of a reassembled PDU]

Frame 77: 1334 bytes on wire (10672 bits), 1334 bytes captured (10672 bits) on interface \Device\NPF_{EE8E3F8B-5495-46B4-9F95-E9AF344B12E7}, id 0
Ethernet II, Src: WiWide_00:00:01 (00:1f:7a:00:00:01), Dst: IntelCor_99:34:96 (c4:d0:e3:99:34:96)
Internet Protocol Version 4, Src: 14.119.104.254, Dst: 172.16.174.121
Transmission Control Protocol, Src Port: 80, Dst Port: 53344, Seq: 4097, Ack: 104, Len: 1280

No.     Time           Source                Destination           Protocol Length Info
     78 20.295093      14.119.104.254        172.16.174.121        TCP      204    80 → 53344 [PSH, ACK] Seq=5377 Ack=104 Win=29056 Len=150 [TCP segment of a reassembled PDU]

Frame 78: 204 bytes on wire (1632 bits), 204 bytes captured (1632 bits) on interface \Device\NPF_{EE8E3F8B-5495-46B4-9F95-E9AF344B12E7}, id 0
Ethernet II, Src: WiWide_00:00:01 (00:1f:7a:00:00:01), Dst: IntelCor_99:34:96 (c4:d0:e3:99:34:96)
Internet Protocol Version 4, Src: 14.119.104.254, Dst: 172.16.174.121
Transmission Control Protocol, Src Port: 80, Dst Port: 53344, Seq: 5377, Ack: 104, Len: 150

No.     Time           Source                Destination           Protocol Length Info
     79 20.295093      14.119.104.254        172.16.174.121        TCP      1334   80 → 53344 [ACK] Seq=5527 Ack=104 Win=29056 Len=1280 [TCP segment of a reassembled PDU]

Frame 79: 1334 bytes on wire (10672 bits), 1334 bytes captured (10672 bits) on interface \Device\NPF_{EE8E3F8B-5495-46B4-9F95-E9AF344B12E7}, id 0
Ethernet II, Src: WiWide_00:00:01 (00:1f:7a:00:00:01), Dst: IntelCor_99:34:96 (c4:d0:e3:99:34:96)
Internet Protocol Version 4, Src: 14.119.104.254, Dst: 172.16.174.121
Transmission Control Protocol, Src Port: 80, Dst Port: 53344, Seq: 5527, Ack: 104, Len: 1280

No.     Time           Source                Destination           Protocol Length Info
     80 20.295093      14.119.104.254        172.16.174.121        TCP      1334   80 → 53344 [ACK] Seq=6807 Ack=104 Win=29056 Len=1280 [TCP segment of a reassembled PDU]

Frame 80: 1334 bytes on wire (10672 bits), 1334 bytes captured (10672 bits) on interface \Device\NPF_{EE8E3F8B-5495-46B4-9F95-E9AF344B12E7}, id 0
Ethernet II, Src: WiWide_00:00:01 (00:1f:7a:00:00:01), Dst: IntelCor_99:34:96 (c4:d0:e3:99:34:96)
Internet Protocol Version 4, Src: 14.119.104.254, Dst: 172.16.174.121
Transmission Control Protocol, Src Port: 80, Dst Port: 53344, Seq: 6807, Ack: 104, Len: 1280

No.     Time           Source                Destination           Protocol Length Info
     81 20.295093      14.119.104.254        172.16.174.121        TCP      1334   80 → 53344 [ACK] Seq=8087 Ack=104 Win=29056 Len=1280 [TCP segment of a reassembled PDU]

Frame 81: 1334 bytes on wire (10672 bits), 1334 bytes captured (10672 bits) on interface \Device\NPF_{EE8E3F8B-5495-46B4-9F95-E9AF344B12E7}, id 0
Ethernet II, Src: WiWide_00:00:01 (00:1f:7a:00:00:01), Dst: IntelCor_99:34:96 (c4:d0:e3:99:34:96)
Internet Protocol Version 4, Src: 14.119.104.254, Dst: 172.16.174.121
Transmission Control Protocol, Src Port: 80, Dst Port: 53344, Seq: 8087, Ack: 104, Len: 1280

No.     Time           Source                Destination           Protocol Length Info
     82 20.295093      14.119.104.254        172.16.174.121        TCP      310    80 → 53344 [PSH, ACK] Seq=9367 Ack=104 Win=29056 Len=256 [TCP segment of a reassembled PDU]

Frame 82: 310 bytes on wire (2480 bits), 310 bytes captured (2480 bits) on interface \Device\NPF_{EE8E3F8B-5495-46B4-9F95-E9AF344B12E7}, id 0
Ethernet II, Src: WiWide_00:00:01 (00:1f:7a:00:00:01), Dst: IntelCor_99:34:96 (c4:d0:e3:99:34:96)
Internet Protocol Version 4, Src: 14.119.104.254, Dst: 172.16.174.121
Transmission Control Protocol, Src Port: 80, Dst Port: 53344, Seq: 9367, Ack: 104, Len: 256

No.     Time           Source                Destination           Protocol Length Info
     83 20.295093      14.119.104.254        172.16.174.121        TCP      1334   80 → 53344 [ACK] Seq=9623 Ack=104 Win=29056 Len=1280 [TCP segment of a reassembled PDU]

Frame 83: 1334 bytes on wire (10672 bits), 1334 bytes captured (10672 bits) on interface \Device\NPF_{EE8E3F8B-5495-46B4-9F95-E9AF344B12E7}, id 0
Ethernet II, Src: WiWide_00:00:01 (00:1f:7a:00:00:01), Dst: IntelCor_99:34:96 (c4:d0:e3:99:34:96)
Internet Protocol Version 4, Src: 14.119.104.254, Dst: 172.16.174.121
Transmission Control Protocol, Src Port: 80, Dst Port: 53344, Seq: 9623, Ack: 104, Len: 1280

No.     Time           Source                Destination           Protocol Length Info
     84 20.295093      14.119.104.254        172.16.174.121        TCP      1334   80 → 53344 [ACK] Seq=10903 Ack=104 Win=29056 Len=1280 [TCP segment of a reassembled PDU]

Frame 84: 1334 bytes on wire (10672 bits), 1334 bytes captured (10672 bits) on interface \Device\NPF_{EE8E3F8B-5495-46B4-9F95-E9AF344B12E7}, id 0
Ethernet II, Src: WiWide_00:00:01 (00:1f:7a:00:00:01), Dst: IntelCor_99:34:96 (c4:d0:e3:99:34:96)
Internet Protocol Version 4, Src: 14.119.104.254, Dst: 172.16.174.121
Transmission Control Protocol, Src Port: 80, Dst Port: 53344, Seq: 10903, Ack: 104, Len: 1280

No.     Time           Source                Destination           Protocol Length Info
     85 20.295093      14.119.104.254        172.16.174.121        TCP      1334   80 → 53344 [ACK] Seq=12183 Ack=104 Win=29056 Len=1280 [TCP segment of a reassembled PDU]

Frame 85: 1334 bytes on wire (10672 bits), 1334 bytes captured (10672 bits) on interface \Device\NPF_{EE8E3F8B-5495-46B4-9F95-E9AF344B12E7}, id 0
Ethernet II, Src: WiWide_00:00:01 (00:1f:7a:00:00:01), Dst: IntelCor_99:34:96 (c4:d0:e3:99:34:96)
Internet Protocol Version 4, Src: 14.119.104.254, Dst: 172.16.174.121
Transmission Control Protocol, Src Port: 80, Dst Port: 53344, Seq: 12183, Ack: 104, Len: 1280

No.     Time           Source                Destination           Protocol Length Info
     86 20.295093      14.119.104.254        172.16.174.121        TCP      1334   80 → 53344 [ACK] Seq=13463 Ack=104 Win=29056 Len=1280 [TCP segment of a reassembled PDU]

Frame 86: 1334 bytes on wire (10672 bits), 1334 bytes captured (10672 bits) on interface \Device\NPF_{EE8E3F8B-5495-46B4-9F95-E9AF344B12E7}, id 0
Ethernet II, Src: WiWide_00:00:01 (00:1f:7a:00:00:01), Dst: IntelCor_99:34:96 (c4:d0:e3:99:34:96)
Internet Protocol Version 4, Src: 14.119.104.254, Dst: 172.16.174.121
Transmission Control Protocol, Src Port: 80, Dst Port: 53344, Seq: 13463, Ack: 104, Len: 1280

No.     Time           Source                Destination           Protocol Length Info
     87 20.295093      14.119.104.254        172.16.174.121        TCP      1334   80 → 53344 [ACK] Seq=14743 Ack=104 Win=29056 Len=1280 [TCP segment of a reassembled PDU]

Frame 87: 1334 bytes on wire (10672 bits), 1334 bytes captured (10672 bits) on interface \Device\NPF_{EE8E3F8B-5495-46B4-9F95-E9AF344B12E7}, id 0
Ethernet II, Src: WiWide_00:00:01 (00:1f:7a:00:00:01), Dst: IntelCor_99:34:96 (c4:d0:e3:99:34:96)
Internet Protocol Version 4, Src: 14.119.104.254, Dst: 172.16.174.121
Transmission Control Protocol, Src Port: 80, Dst Port: 53344, Seq: 14743, Ack: 104, Len: 1280

No.     Time           Source                Destination           Protocol Length Info
     88 20.295093      14.119.104.254        172.16.174.121        TCP      1334   80 → 53344 [ACK] Seq=16023 Ack=104 Win=29056 Len=1280 [TCP segment of a reassembled PDU]

Frame 88: 1334 bytes on wire (10672 bits), 1334 bytes captured (10672 bits) on interface \Device\NPF_{EE8E3F8B-5495-46B4-9F95-E9AF344B12E7}, id 0
Ethernet II, Src: WiWide_00:00:01 (00:1f:7a:00:00:01), Dst: IntelCor_99:34:96 (c4:d0:e3:99:34:96)
Internet Protocol Version 4, Src: 14.119.104.254, Dst: 172.16.174.121
Transmission Control Protocol, Src Port: 80, Dst Port: 53344, Seq: 16023, Ack: 104, Len: 1280

No.     Time           Source                Destination           Protocol Length Info
     89 20.295093      14.119.104.254        172.16.174.121        TCP      1334   80 → 53344 [ACK] Seq=17303 Ack=104 Win=29056 Len=1280 [TCP segment of a reassembled PDU]

Frame 89: 1334 bytes on wire (10672 bits), 1334 bytes captured (10672 bits) on interface \Device\NPF_{EE8E3F8B-5495-46B4-9F95-E9AF344B12E7}, id 0
Ethernet II, Src: WiWide_00:00:01 (00:1f:7a:00:00:01), Dst: IntelCor_99:34:96 (c4:d0:e3:99:34:96)
Internet Protocol Version 4, Src: 14.119.104.254, Dst: 172.16.174.121
Transmission Control Protocol, Src Port: 80, Dst Port: 53344, Seq: 17303, Ack: 104, Len: 1280

No.     Time           Source                Destination           Protocol Length Info
     90 20.295093      14.119.104.254        172.16.174.121        TCP      1334   80 → 53344 [ACK] Seq=18583 Ack=104 Win=29056 Len=1280 [TCP segment of a reassembled PDU]

Frame 90: 1334 bytes on wire (10672 bits), 1334 bytes captured (10672 bits) on interface \Device\NPF_{EE8E3F8B-5495-46B4-9F95-E9AF344B12E7}, id 0
Ethernet II, Src: WiWide_00:00:01 (00:1f:7a:00:00:01), Dst: IntelCor_99:34:96 (c4:d0:e3:99:34:96)
Internet Protocol Version 4, Src: 14.119.104.254, Dst: 172.16.174.121
Transmission Control Protocol, Src Port: 80, Dst Port: 53344, Seq: 18583, Ack: 104, Len: 1280

No.     Time           Source                Destination           Protocol Length Info
     91 20.295093      14.119.104.254        172.16.174.121        TCP      1334   80 → 53344 [ACK] Seq=19863 Ack=104 Win=29056 Len=1280 [TCP segment of a reassembled PDU]

Frame 91: 1334 bytes on wire (10672 bits), 1334 bytes captured (10672 bits) on interface \Device\NPF_{EE8E3F8B-5495-46B4-9F95-E9AF344B12E7}, id 0
Ethernet II, Src: WiWide_00:00:01 (00:1f:7a:00:00:01), Dst: IntelCor_99:34:96 (c4:d0:e3:99:34:96)
Internet Protocol Version 4, Src: 14.119.104.254, Dst: 172.16.174.121
Transmission Control Protocol, Src Port: 80, Dst Port: 53344, Seq: 19863, Ack: 104, Len: 1280

No.     Time           Source                Destination           Protocol Length Info
     92 20.295093      14.119.104.254        172.16.174.121        TCP      1334   80 → 53344 [ACK] Seq=21143 Ack=104 Win=29056 Len=1280 [TCP segment of a reassembled PDU]

Frame 92: 1334 bytes on wire (10672 bits), 1334 bytes captured (10672 bits) on interface \Device\NPF_{EE8E3F8B-5495-46B4-9F95-E9AF344B12E7}, id 0
Ethernet II, Src: WiWide_00:00:01 (00:1f:7a:00:00:01), Dst: IntelCor_99:34:96 (c4:d0:e3:99:34:96)
Internet Protocol Version 4, Src: 14.119.104.254, Dst: 172.16.174.121
Transmission Control Protocol, Src Port: 80, Dst Port: 53344, Seq: 21143, Ack: 104, Len: 1280

No.     Time           Source                Destination           Protocol Length Info
     93 20.295093      14.119.104.254        172.16.174.121        TCP      1334   80 → 53344 [ACK] Seq=22423 Ack=104 Win=29056 Len=1280 [TCP segment of a reassembled PDU]

Frame 93: 1334 bytes on wire (10672 bits), 1334 bytes captured (10672 bits) on interface \Device\NPF_{EE8E3F8B-5495-46B4-9F95-E9AF344B12E7}, id 0
Ethernet II, Src: WiWide_00:00:01 (00:1f:7a:00:00:01), Dst: IntelCor_99:34:96 (c4:d0:e3:99:34:96)
Internet Protocol Version 4, Src: 14.119.104.254, Dst: 172.16.174.121
Transmission Control Protocol, Src Port: 80, Dst Port: 53344, Seq: 22423, Ack: 104, Len: 1280

No.     Time           Source                Destination           Protocol Length Info
     94 20.295093      14.119.104.254        172.16.174.121        TCP      1334   80 → 53344 [ACK] Seq=23703 Ack=104 Win=29056 Len=1280 [TCP segment of a reassembled PDU]

Frame 94: 1334 bytes on wire (10672 bits), 1334 bytes captured (10672 bits) on interface \Device\NPF_{EE8E3F8B-5495-46B4-9F95-E9AF344B12E7}, id 0
Ethernet II, Src: WiWide_00:00:01 (00:1f:7a:00:00:01), Dst: IntelCor_99:34:96 (c4:d0:e3:99:34:96)
Internet Protocol Version 4, Src: 14.119.104.254, Dst: 172.16.174.121
Transmission Control Protocol, Src Port: 80, Dst Port: 53344, Seq: 23703, Ack: 104, Len: 1280

No.     Time           Source                Destination           Protocol Length Info
     95 20.295093      14.119.104.254        172.16.174.121        TCP      1334   80 → 53344 [ACK] Seq=24983 Ack=104 Win=29056 Len=1280 [TCP segment of a reassembled PDU]

Frame 95: 1334 bytes on wire (10672 bits), 1334 bytes captured (10672 bits) on interface \Device\NPF_{EE8E3F8B-5495-46B4-9F95-E9AF344B12E7}, id 0
Ethernet II, Src: WiWide_00:00:01 (00:1f:7a:00:00:01), Dst: IntelCor_99:34:96 (c4:d0:e3:99:34:96)
Internet Protocol Version 4, Src: 14.119.104.254, Dst: 172.16.174.121
Transmission Control Protocol, Src Port: 80, Dst Port: 53344, Seq: 24983, Ack: 104, Len: 1280

No.     Time           Source                Destination           Protocol Length Info
     96 20.295093      14.119.104.254        172.16.174.121        TCP      1334   80 → 53344 [ACK] Seq=26263 Ack=104 Win=29056 Len=1280 [TCP segment of a reassembled PDU]

Frame 96: 1334 bytes on wire (10672 bits), 1334 bytes captured (10672 bits) on interface \Device\NPF_{EE8E3F8B-5495-46B4-9F95-E9AF344B12E7}, id 0
Ethernet II, Src: WiWide_00:00:01 (00:1f:7a:00:00:01), Dst: IntelCor_99:34:96 (c4:d0:e3:99:34:96)
Internet Protocol Version 4, Src: 14.119.104.254, Dst: 172.16.174.121
Transmission Control Protocol, Src Port: 80, Dst Port: 53344, Seq: 26263, Ack: 104, Len: 1280

No.     Time           Source                Destination           Protocol Length Info
     97 20.295093      14.119.104.254        172.16.174.121        TCP      1334   80 → 53344 [ACK] Seq=27543 Ack=104 Win=29056 Len=1280 [TCP segment of a reassembled PDU]

Frame 97: 1334 bytes on wire (10672 bits), 1334 bytes captured (10672 bits) on interface \Device\NPF_{EE8E3F8B-5495-46B4-9F95-E9AF344B12E7}, id 0
Ethernet II, Src: WiWide_00:00:01 (00:1f:7a:00:00:01), Dst: IntelCor_99:34:96 (c4:d0:e3:99:34:96)
Internet Protocol Version 4, Src: 14.119.104.254, Dst: 172.16.174.121
Transmission Control Protocol, Src Port: 80, Dst Port: 53344, Seq: 27543, Ack: 104, Len: 1280

No.     Time           Source                Destination           Protocol Length Info
     98 20.295093      14.119.104.254        172.16.174.121        TCP      1334   80 → 53344 [ACK] Seq=28823 Ack=104 Win=29056 Len=1280 [TCP segment of a reassembled PDU]

Frame 98: 1334 bytes on wire (10672 bits), 1334 bytes captured (10672 bits) on interface \Device\NPF_{EE8E3F8B-5495-46B4-9F95-E9AF344B12E7}, id 0
Ethernet II, Src: WiWide_00:00:01 (00:1f:7a:00:00:01), Dst: IntelCor_99:34:96 (c4:d0:e3:99:34:96)
Internet Protocol Version 4, Src: 14.119.104.254, Dst: 172.16.174.121
Transmission Control Protocol, Src Port: 80, Dst Port: 53344, Seq: 28823, Ack: 104, Len: 1280

No.     Time           Source                Destination           Protocol Length Info
     99 20.295093      14.119.104.254        172.16.174.121        TCP      1334   80 → 53344 [ACK] Seq=30103 Ack=104 Win=29056 Len=1280 [TCP segment of a reassembled PDU]

Frame 99: 1334 bytes on wire (10672 bits), 1334 bytes captured (10672 bits) on interface \Device\NPF_{EE8E3F8B-5495-46B4-9F95-E9AF344B12E7}, id 0
Ethernet II, Src: WiWide_00:00:01 (00:1f:7a:00:00:01), Dst: IntelCor_99:34:96 (c4:d0:e3:99:34:96)
Internet Protocol Version 4, Src: 14.119.104.254, Dst: 172.16.174.121
Transmission Control Protocol, Src Port: 80, Dst Port: 53344, Seq: 30103, Ack: 104, Len: 1280

No.     Time           Source                Destination           Protocol Length Info
    100 20.295093      14.119.104.254        172.16.174.121        TCP      1334   80 → 53344 [ACK] Seq=31383 Ack=104 Win=29056 Len=1280 [TCP segment of a reassembled PDU]

Frame 100: 1334 bytes on wire (10672 bits), 1334 bytes captured (10672 bits) on interface \Device\NPF_{EE8E3F8B-5495-46B4-9F95-E9AF344B12E7}, id 0
Ethernet II, Src: WiWide_00:00:01 (00:1f:7a:00:00:01), Dst: IntelCor_99:34:96 (c4:d0:e3:99:34:96)
Internet Protocol Version 4, Src: 14.119.104.254, Dst: 172.16.174.121
Transmission Control Protocol, Src Port: 80, Dst Port: 53344, Seq: 31383, Ack: 104, Len: 1280

No.     Time           Source                Destination           Protocol Length Info
    101 20.295204      172.16.174.121        14.119.104.254        TCP      54     53344 → 80 [ACK] Seq=104 Ack=32663 Win=131072 Len=0

Frame 101: 54 bytes on wire (432 bits), 54 bytes captured (432 bits) on interface \Device\NPF_{EE8E3F8B-5495-46B4-9F95-E9AF344B12E7}, id 0
Ethernet II, Src: IntelCor_99:34:96 (c4:d0:e3:99:34:96), Dst: WiWide_00:00:01 (00:1f:7a:00:00:01)
Internet Protocol Version 4, Src: 172.16.174.121, Dst: 14.119.104.254
Transmission Control Protocol, Src Port: 53344, Dst Port: 80, Seq: 104, Ack: 32663, Len: 0

No.     Time           Source                Destination           Protocol Length Info
    102 20.303675      14.119.104.254        172.16.174.121        TCP      1334   80 → 53344 [ACK] Seq=32663 Ack=104 Win=29056 Len=1280 [TCP segment of a reassembled PDU]

Frame 102: 1334 bytes on wire (10672 bits), 1334 bytes captured (10672 bits) on interface \Device\NPF_{EE8E3F8B-5495-46B4-9F95-E9AF344B12E7}, id 0
Ethernet II, Src: WiWide_00:00:01 (00:1f:7a:00:00:01), Dst: IntelCor_99:34:96 (c4:d0:e3:99:34:96)
Internet Protocol Version 4, Src: 14.119.104.254, Dst: 172.16.174.121
Transmission Control Protocol, Src Port: 80, Dst Port: 53344, Seq: 32663, Ack: 104, Len: 1280

No.     Time           Source                Destination           Protocol Length Info
    103 20.303675      14.119.104.254        172.16.174.121        TCP      1334   80 → 53344 [ACK] Seq=33943 Ack=104 Win=29056 Len=1280 [TCP segment of a reassembled PDU]

Frame 103: 1334 bytes on wire (10672 bits), 1334 bytes captured (10672 bits) on interface \Device\NPF_{EE8E3F8B-5495-46B4-9F95-E9AF344B12E7}, id 0
Ethernet II, Src: WiWide_00:00:01 (00:1f:7a:00:00:01), Dst: IntelCor_99:34:96 (c4:d0:e3:99:34:96)
Internet Protocol Version 4, Src: 14.119.104.254, Dst: 172.16.174.121
Transmission Control Protocol, Src Port: 80, Dst Port: 53344, Seq: 33943, Ack: 104, Len: 1280

No.     Time           Source                Destination           Protocol Length Info
    104 20.303675      14.119.104.254        172.16.174.121        TCP      1334   80 → 53344 [ACK] Seq=35223 Ack=104 Win=29056 Len=1280 [TCP segment of a reassembled PDU]

Frame 104: 1334 bytes on wire (10672 bits), 1334 bytes captured (10672 bits) on interface \Device\NPF_{EE8E3F8B-5495-46B4-9F95-E9AF344B12E7}, id 0
Ethernet II, Src: WiWide_00:00:01 (00:1f:7a:00:00:01), Dst: IntelCor_99:34:96 (c4:d0:e3:99:34:96)
Internet Protocol Version 4, Src: 14.119.104.254, Dst: 172.16.174.121
Transmission Control Protocol, Src Port: 80, Dst Port: 53344, Seq: 35223, Ack: 104, Len: 1280

No.     Time           Source                Destination           Protocol Length Info
    105 20.303675      14.119.104.254        172.16.174.121        TCP      1334   80 → 53344 [ACK] Seq=36503 Ack=104 Win=29056 Len=1280 [TCP segment of a reassembled PDU]

Frame 105: 1334 bytes on wire (10672 bits), 1334 bytes captured (10672 bits) on interface \Device\NPF_{EE8E3F8B-5495-46B4-9F95-E9AF344B12E7}, id 0
Ethernet II, Src: WiWide_00:00:01 (00:1f:7a:00:00:01), Dst: IntelCor_99:34:96 (c4:d0:e3:99:34:96)
Internet Protocol Version 4, Src: 14.119.104.254, Dst: 172.16.174.121
Transmission Control Protocol, Src Port: 80, Dst Port: 53344, Seq: 36503, Ack: 104, Len: 1280

No.     Time           Source                Destination           Protocol Length Info
    106 20.303675      14.119.104.254        172.16.174.121        TCP      1334   80 → 53344 [ACK] Seq=37783 Ack=104 Win=29056 Len=1280 [TCP segment of a reassembled PDU]

Frame 106: 1334 bytes on wire (10672 bits), 1334 bytes captured (10672 bits) on interface \Device\NPF_{EE8E3F8B-5495-46B4-9F95-E9AF344B12E7}, id 0
Ethernet II, Src: WiWide_00:00:01 (00:1f:7a:00:00:01), Dst: IntelCor_99:34:96 (c4:d0:e3:99:34:96)
Internet Protocol Version 4, Src: 14.119.104.254, Dst: 172.16.174.121
Transmission Control Protocol, Src Port: 80, Dst Port: 53344, Seq: 37783, Ack: 104, Len: 1280

No.     Time           Source                Destination           Protocol Length Info
    107 20.303713      172.16.174.121        14.119.104.254        TCP      54     53344 → 80 [ACK] Seq=104 Ack=39063 Win=131072 Len=0

Frame 107: 54 bytes on wire (432 bits), 54 bytes captured (432 bits) on interface \Device\NPF_{EE8E3F8B-5495-46B4-9F95-E9AF344B12E7}, id 0
Ethernet II, Src: IntelCor_99:34:96 (c4:d0:e3:99:34:96), Dst: WiWide_00:00:01 (00:1f:7a:00:00:01)
Internet Protocol Version 4, Src: 172.16.174.121, Dst: 14.119.104.254
Transmission Control Protocol, Src Port: 53344, Dst Port: 80, Seq: 104, Ack: 39063, Len: 0

No.     Time           Source                Destination           Protocol Length Info
    109 20.305133      14.119.104.254        172.16.174.121        TCP      1334   80 → 53344 [ACK] Seq=39063 Ack=104 Win=29056 Len=1280 [TCP segment of a reassembled PDU]

Frame 109: 1334 bytes on wire (10672 bits), 1334 bytes captured (10672 bits) on interface \Device\NPF_{EE8E3F8B-5495-46B4-9F95-E9AF344B12E7}, id 0
Ethernet II, Src: WiWide_00:00:01 (00:1f:7a:00:00:01), Dst: IntelCor_99:34:96 (c4:d0:e3:99:34:96)
Internet Protocol Version 4, Src: 14.119.104.254, Dst: 172.16.174.121
Transmission Control Protocol, Src Port: 80, Dst Port: 53344, Seq: 39063, Ack: 104, Len: 1280

No.     Time           Source                Destination           Protocol Length Info
    110 20.305133      14.119.104.254        172.16.174.121        TCP      1334   80 → 53344 [ACK] Seq=40343 Ack=104 Win=29056 Len=1280 [TCP segment of a reassembled PDU]

Frame 110: 1334 bytes on wire (10672 bits), 1334 bytes captured (10672 bits) on interface \Device\NPF_{EE8E3F8B-5495-46B4-9F95-E9AF344B12E7}, id 0
Ethernet II, Src: WiWide_00:00:01 (00:1f:7a:00:00:01), Dst: IntelCor_99:34:96 (c4:d0:e3:99:34:96)
Internet Protocol Version 4, Src: 14.119.104.254, Dst: 172.16.174.121
Transmission Control Protocol, Src Port: 80, Dst Port: 53344, Seq: 40343, Ack: 104, Len: 1280

No.     Time           Source                Destination           Protocol Length Info
    111 20.305133      14.119.104.254        172.16.174.121        TCP      1334   80 → 53344 [ACK] Seq=41623 Ack=104 Win=29056 Len=1280 [TCP segment of a reassembled PDU]

Frame 111: 1334 bytes on wire (10672 bits), 1334 bytes captured (10672 bits) on interface \Device\NPF_{EE8E3F8B-5495-46B4-9F95-E9AF344B12E7}, id 0
Ethernet II, Src: WiWide_00:00:01 (00:1f:7a:00:00:01), Dst: IntelCor_99:34:96 (c4:d0:e3:99:34:96)
Internet Protocol Version 4, Src: 14.119.104.254, Dst: 172.16.174.121
Transmission Control Protocol, Src Port: 80, Dst Port: 53344, Seq: 41623, Ack: 104, Len: 1280

No.     Time           Source                Destination           Protocol Length Info
    112 20.305133      14.119.104.254        172.16.174.121        TCP      1334   80 → 53344 [ACK] Seq=42903 Ack=104 Win=29056 Len=1280 [TCP segment of a reassembled PDU]

Frame 112: 1334 bytes on wire (10672 bits), 1334 bytes captured (10672 bits) on interface \Device\NPF_{EE8E3F8B-5495-46B4-9F95-E9AF344B12E7}, id 0
Ethernet II, Src: WiWide_00:00:01 (00:1f:7a:00:00:01), Dst: IntelCor_99:34:96 (c4:d0:e3:99:34:96)
Internet Protocol Version 4, Src: 14.119.104.254, Dst: 172.16.174.121
Transmission Control Protocol, Src Port: 80, Dst Port: 53344, Seq: 42903, Ack: 104, Len: 1280

No.     Time           Source                Destination           Protocol Length Info
    113 20.305133      14.119.104.254        172.16.174.121        TCP      1334   80 → 53344 [ACK] Seq=44183 Ack=104 Win=29056 Len=1280 [TCP segment of a reassembled PDU]

Frame 113: 1334 bytes on wire (10672 bits), 1334 bytes captured (10672 bits) on interface \Device\NPF_{EE8E3F8B-5495-46B4-9F95-E9AF344B12E7}, id 0
Ethernet II, Src: WiWide_00:00:01 (00:1f:7a:00:00:01), Dst: IntelCor_99:34:96 (c4:d0:e3:99:34:96)
Internet Protocol Version 4, Src: 14.119.104.254, Dst: 172.16.174.121
Transmission Control Protocol, Src Port: 80, Dst Port: 53344, Seq: 44183, Ack: 104, Len: 1280

No.     Time           Source                Destination           Protocol Length Info
    114 20.305133      14.119.104.254        172.16.174.121        TCP      1334   80 → 53344 [ACK] Seq=45463 Ack=104 Win=29056 Len=1280 [TCP segment of a reassembled PDU]

Frame 114: 1334 bytes on wire (10672 bits), 1334 bytes captured (10672 bits) on interface \Device\NPF_{EE8E3F8B-5495-46B4-9F95-E9AF344B12E7}, id 0
Ethernet II, Src: WiWide_00:00:01 (00:1f:7a:00:00:01), Dst: IntelCor_99:34:96 (c4:d0:e3:99:34:96)
Internet Protocol Version 4, Src: 14.119.104.254, Dst: 172.16.174.121
Transmission Control Protocol, Src Port: 80, Dst Port: 53344, Seq: 45463, Ack: 104, Len: 1280

No.     Time           Source                Destination           Protocol Length Info
    115 20.305133      14.119.104.254        172.16.174.121        TCP      1334   80 → 53344 [ACK] Seq=46743 Ack=104 Win=29056 Len=1280 [TCP segment of a reassembled PDU]

Frame 115: 1334 bytes on wire (10672 bits), 1334 bytes captured (10672 bits) on interface \Device\NPF_{EE8E3F8B-5495-46B4-9F95-E9AF344B12E7}, id 0
Ethernet II, Src: WiWide_00:00:01 (00:1f:7a:00:00:01), Dst: IntelCor_99:34:96 (c4:d0:e3:99:34:96)
Internet Protocol Version 4, Src: 14.119.104.254, Dst: 172.16.174.121
Transmission Control Protocol, Src Port: 80, Dst Port: 53344, Seq: 46743, Ack: 104, Len: 1280

No.     Time           Source                Destination           Protocol Length Info
    116 20.305133      14.119.104.254        172.16.174.121        TCP      1334   80 → 53344 [ACK] Seq=48023 Ack=104 Win=29056 Len=1280 [TCP segment of a reassembled PDU]

Frame 116: 1334 bytes on wire (10672 bits), 1334 bytes captured (10672 bits) on interface \Device\NPF_{EE8E3F8B-5495-46B4-9F95-E9AF344B12E7}, id 0
Ethernet II, Src: WiWide_00:00:01 (00:1f:7a:00:00:01), Dst: IntelCor_99:34:96 (c4:d0:e3:99:34:96)
Internet Protocol Version 4, Src: 14.119.104.254, Dst: 172.16.174.121
Transmission Control Protocol, Src Port: 80, Dst Port: 53344, Seq: 48023, Ack: 104, Len: 1280

No.     Time           Source                Destination           Protocol Length Info
    117 20.305133      14.119.104.254        172.16.174.121        TCP      1334   80 → 53344 [ACK] Seq=49303 Ack=104 Win=29056 Len=1280 [TCP segment of a reassembled PDU]

Frame 117: 1334 bytes on wire (10672 bits), 1334 bytes captured (10672 bits) on interface \Device\NPF_{EE8E3F8B-5495-46B4-9F95-E9AF344B12E7}, id 0
Ethernet II, Src: WiWide_00:00:01 (00:1f:7a:00:00:01), Dst: IntelCor_99:34:96 (c4:d0:e3:99:34:96)
Internet Protocol Version 4, Src: 14.119.104.254, Dst: 172.16.174.121
Transmission Control Protocol, Src Port: 80, Dst Port: 53344, Seq: 49303, Ack: 104, Len: 1280

No.     Time           Source                Destination           Protocol Length Info
    118 20.305133      14.119.104.254        172.16.174.121        TCP      1334   80 → 53344 [ACK] Seq=50583 Ack=104 Win=29056 Len=1280 [TCP segment of a reassembled PDU]

Frame 118: 1334 bytes on wire (10672 bits), 1334 bytes captured (10672 bits) on interface \Device\NPF_{EE8E3F8B-5495-46B4-9F95-E9AF344B12E7}, id 0
Ethernet II, Src: WiWide_00:00:01 (00:1f:7a:00:00:01), Dst: IntelCor_99:34:96 (c4:d0:e3:99:34:96)
Internet Protocol Version 4, Src: 14.119.104.254, Dst: 172.16.174.121
Transmission Control Protocol, Src Port: 80, Dst Port: 53344, Seq: 50583, Ack: 104, Len: 1280

No.     Time           Source                Destination           Protocol Length Info
    119 20.305133      14.119.104.254        172.16.174.121        TCP      1334   80 → 53344 [ACK] Seq=51863 Ack=104 Win=29056 Len=1280 [TCP segment of a reassembled PDU]

Frame 119: 1334 bytes on wire (10672 bits), 1334 bytes captured (10672 bits) on interface \Device\NPF_{EE8E3F8B-5495-46B4-9F95-E9AF344B12E7}, id 0
Ethernet II, Src: WiWide_00:00:01 (00:1f:7a:00:00:01), Dst: IntelCor_99:34:96 (c4:d0:e3:99:34:96)
Internet Protocol Version 4, Src: 14.119.104.254, Dst: 172.16.174.121
Transmission Control Protocol, Src Port: 80, Dst Port: 53344, Seq: 51863, Ack: 104, Len: 1280

No.     Time           Source                Destination           Protocol Length Info
    120 20.305133      14.119.104.254        172.16.174.121        TCP      1334   80 → 53344 [ACK] Seq=53143 Ack=104 Win=29056 Len=1280 [TCP segment of a reassembled PDU]

Frame 120: 1334 bytes on wire (10672 bits), 1334 bytes captured (10672 bits) on interface \Device\NPF_{EE8E3F8B-5495-46B4-9F95-E9AF344B12E7}, id 0
Ethernet II, Src: WiWide_00:00:01 (00:1f:7a:00:00:01), Dst: IntelCor_99:34:96 (c4:d0:e3:99:34:96)
Internet Protocol Version 4, Src: 14.119.104.254, Dst: 172.16.174.121
Transmission Control Protocol, Src Port: 80, Dst Port: 53344, Seq: 53143, Ack: 104, Len: 1280

No.     Time           Source                Destination           Protocol Length Info
    121 20.305133      14.119.104.254        172.16.174.121        TCP      1334   80 → 53344 [ACK] Seq=54423 Ack=104 Win=29056 Len=1280 [TCP segment of a reassembled PDU]

Frame 121: 1334 bytes on wire (10672 bits), 1334 bytes captured (10672 bits) on interface \Device\NPF_{EE8E3F8B-5495-46B4-9F95-E9AF344B12E7}, id 0
Ethernet II, Src: WiWide_00:00:01 (00:1f:7a:00:00:01), Dst: IntelCor_99:34:96 (c4:d0:e3:99:34:96)
Internet Protocol Version 4, Src: 14.119.104.254, Dst: 172.16.174.121
Transmission Control Protocol, Src Port: 80, Dst Port: 53344, Seq: 54423, Ack: 104, Len: 1280

No.     Time           Source                Destination           Protocol Length Info
    122 20.305133      14.119.104.254        172.16.174.121        TCP      1334   80 → 53344 [ACK] Seq=55703 Ack=104 Win=29056 Len=1280 [TCP segment of a reassembled PDU]

Frame 122: 1334 bytes on wire (10672 bits), 1334 bytes captured (10672 bits) on interface \Device\NPF_{EE8E3F8B-5495-46B4-9F95-E9AF344B12E7}, id 0
Ethernet II, Src: WiWide_00:00:01 (00:1f:7a:00:00:01), Dst: IntelCor_99:34:96 (c4:d0:e3:99:34:96)
Internet Protocol Version 4, Src: 14.119.104.254, Dst: 172.16.174.121
Transmission Control Protocol, Src Port: 80, Dst Port: 53344, Seq: 55703, Ack: 104, Len: 1280

No.     Time           Source                Destination           Protocol Length Info
    123 20.305133      14.119.104.254        172.16.174.121        TCP      1334   80 → 53344 [ACK] Seq=56983 Ack=104 Win=29056 Len=1280 [TCP segment of a reassembled PDU]

Frame 123: 1334 bytes on wire (10672 bits), 1334 bytes captured (10672 bits) on interface \Device\NPF_{EE8E3F8B-5495-46B4-9F95-E9AF344B12E7}, id 0
Ethernet II, Src: WiWide_00:00:01 (00:1f:7a:00:00:01), Dst: IntelCor_99:34:96 (c4:d0:e3:99:34:96)
Internet Protocol Version 4, Src: 14.119.104.254, Dst: 172.16.174.121
Transmission Control Protocol, Src Port: 80, Dst Port: 53344, Seq: 56983, Ack: 104, Len: 1280

No.     Time           Source                Destination           Protocol Length Info
    124 20.305133      14.119.104.254        172.16.174.121        TCP      1334   80 → 53344 [ACK] Seq=58263 Ack=104 Win=29056 Len=1280 [TCP segment of a reassembled PDU]

Frame 124: 1334 bytes on wire (10672 bits), 1334 bytes captured (10672 bits) on interface \Device\NPF_{EE8E3F8B-5495-46B4-9F95-E9AF344B12E7}, id 0
Ethernet II, Src: WiWide_00:00:01 (00:1f:7a:00:00:01), Dst: IntelCor_99:34:96 (c4:d0:e3:99:34:96)
Internet Protocol Version 4, Src: 14.119.104.254, Dst: 172.16.174.121
Transmission Control Protocol, Src Port: 80, Dst Port: 53344, Seq: 58263, Ack: 104, Len: 1280

No.     Time           Source                Destination           Protocol Length Info
    125 20.305133      14.119.104.254        172.16.174.121        TCP      1334   80 → 53344 [ACK] Seq=59543 Ack=104 Win=29056 Len=1280 [TCP segment of a reassembled PDU]

Frame 125: 1334 bytes on wire (10672 bits), 1334 bytes captured (10672 bits) on interface \Device\NPF_{EE8E3F8B-5495-46B4-9F95-E9AF344B12E7}, id 0
Ethernet II, Src: WiWide_00:00:01 (00:1f:7a:00:00:01), Dst: IntelCor_99:34:96 (c4:d0:e3:99:34:96)
Internet Protocol Version 4, Src: 14.119.104.254, Dst: 172.16.174.121
Transmission Control Protocol, Src Port: 80, Dst Port: 53344, Seq: 59543, Ack: 104, Len: 1280

No.     Time           Source                Destination           Protocol Length Info
    126 20.305133      14.119.104.254        172.16.174.121        TCP      1334   80 → 53344 [ACK] Seq=60823 Ack=104 Win=29056 Len=1280 [TCP segment of a reassembled PDU]

Frame 126: 1334 bytes on wire (10672 bits), 1334 bytes captured (10672 bits) on interface \Device\NPF_{EE8E3F8B-5495-46B4-9F95-E9AF344B12E7}, id 0
Ethernet II, Src: WiWide_00:00:01 (00:1f:7a:00:00:01), Dst: IntelCor_99:34:96 (c4:d0:e3:99:34:96)
Internet Protocol Version 4, Src: 14.119.104.254, Dst: 172.16.174.121
Transmission Control Protocol, Src Port: 80, Dst Port: 53344, Seq: 60823, Ack: 104, Len: 1280

No.     Time           Source                Destination           Protocol Length Info
    127 20.305133      14.119.104.254        172.16.174.121        TCP      1334   80 → 53344 [ACK] Seq=62103 Ack=104 Win=29056 Len=1280 [TCP segment of a reassembled PDU]

Frame 127: 1334 bytes on wire (10672 bits), 1334 bytes captured (10672 bits) on interface \Device\NPF_{EE8E3F8B-5495-46B4-9F95-E9AF344B12E7}, id 0
Ethernet II, Src: WiWide_00:00:01 (00:1f:7a:00:00:01), Dst: IntelCor_99:34:96 (c4:d0:e3:99:34:96)
Internet Protocol Version 4, Src: 14.119.104.254, Dst: 172.16.174.121
Transmission Control Protocol, Src Port: 80, Dst Port: 53344, Seq: 62103, Ack: 104, Len: 1280

No.     Time           Source                Destination           Protocol Length Info
    128 20.305133      14.119.104.254        172.16.174.121        TCP      1334   80 → 53344 [ACK] Seq=63383 Ack=104 Win=29056 Len=1280 [TCP segment of a reassembled PDU]

